{
  "schema_version": 5,
  "workflow_id": "WF-20260801-01",
  "group_id": "PMG-20260801-01",
  "action_id": "PMA-20260801-01",
  "approved_by": "release-lead",
  "approved_at": "2026-08-01T00:00:00Z",
  "started_at": "2026-08-01T00:01:00Z",
  "ended_at": "2026-08-01T00:02:00Z",
  "tool_result": "success",
  "created_ids": [],
  "before_state": {
    "status": "Ready"
  },
  "after_state": {
    "comment_added": true
  },
  "verification": "passed",
  "failure": null,
  "rollback_guidance": "Remove the comment if evidence is incorrect"
}
